OperationName,OperationNameValue,Category,CategoryValue
Account HnsOn Migration,Microsoft.Storage/storageAccounts/hnsonmigration/action,Administrative,Administrative
Add API to product,Microsoft.ApiManagement/service/products/apis/write,Administrative,Administrative
Add backend or Update backend,Microsoft.ApiManagement/service/backends/write,Administrative,Administrative
Add language extensions action,Microsoft.Synapse/workspaces/kustoPools/addLanguageExtensions/action,Administrative,Administrative
Add management locks,Microsoft.Authorization/locks/write,Administrative,Administrative
Add management locks,microsoft.authorization/locks/write,Administrative,Administrative
Add or modify schedules.,Microsoft.DevTestLab/schedules/write,Administrative,Administrative
Add or Update Connection,Microsoft.Web/connections/write,Administrative,Administrative
Add Provider Subscription Feature Registration,Microsoft.Features/featureProviders/subscriptionFeatureRegistrations/write,Administrative,Administrative
Add root collection admin to account resource,Microsoft.Purview/accounts/addRootCollectionAdmin/action,Administrative,Administrative
Adds or updates a specific Azure Active Directory administrator object,Microsoft.Sql/servers/administrators/write,Administrative,Administrative
Assess virtual machine for available OS update patches,Microsoft.Compute/virtualMachines/assessPatches/action,Administrative,Administrative
Assess virtual machine for available OS update patches,microsoft.compute/virtualmachines/assessPatches/action,Administrative,Administrative
Associate group with product,Microsoft.ApiManagement/service/products/groups/write,Administrative,Administrative
Backup Protected Item,Microsoft.RecoveryServices/vaults/backupFabrics/protectionContainers/protectedItems/backup/action,Administrative,Administrative
BackupWebSite,BackupWebSite,Administrative,Administrative
Cancel Deployment,Microsoft.Resources/deployments/cancel/action,Administrative,Administrative
Change state of Private Endpoint Connection Proxy,Microsoft.KeyVault/vaults/privateEndpointConnectionProxies/write,Administrative,Administrative
Check Accelerated Networking support,Microsoft.Network/locations/checkAcceleratedNetworkingSupport/action,Administrative,Administrative
Check Backup Status for Vault,Microsoft.RecoveryServices/locations/backupStatus/action,Administrative,Administrative
Check name availability action,Microsoft.Synapse/locations/kustoPoolCheckNameAvailability/action,Administrative,Administrative
Check Resource Name Availability Action,Microsoft.RecoveryServices/locations/checkNameAvailability/action,Administrative,Administrative
Check Server Name Availability,Microsoft.DBforPostgreSQL/checkNameAvailability/action,Administrative,Administrative
Check Server Name Availability,Microsoft.Sql/checkNameAvailability/action,Administrative,Administrative
Check Service Name Availability,Microsoft.Search/checkNameAvailability/action,Administrative,Administrative
Checks Default Storage Account Status.,Microsoft.Synapse/workspaces/checkDefaultStorageAccountStatus/action,Administrative,Administrative
Checks name for compute in batch endpoint in Machine Learning Services Workspace(s),Microsoft.MachineLearningServices/workspaces/checkComputeNameAvailability/action,Administrative,Administrative
Checks Workspace name availability.,Microsoft.Synapse/checkNameAvailability/action,Administrative,Administrative
Cluster check name availability action,Microsoft.Kusto/clusters/checkNameAvailability/action,Administrative,Administrative
Cluster check name availability action,Microsoft.Synapse/workspaces/kustopools/checkNameAvailability/action,Administrative,Administrative
Cluster check name availability action,Microsoft.Synapse/workspaces/kustoPools/checkNameAvailability/action,Administrative,Administrative
Cluster start action,Microsoft.Synapse/workspaces/kustoPools/start/action,Administrative,Administrative
Cluster stop action,Microsoft.Kusto/Clusters/stop/action,Administrative,Administrative
Cluster stop action,Microsoft.Synapse/workspaces/kustoPools/stop/action,Administrative,Administrative
Confirm Connections Consent Code,Microsoft.Web/connections/confirmConsentCode/action,Administrative,Administrative
Connect,Microsoft.SerialConsole/serialPorts/connect/action,Administrative,Administrative
Convert Graph Runbook Content to its raw serialized format and vice-versa,Microsoft.Automation/automationAccounts/convertGraphRunbookContent/action,Administrative,Administrative
Convert Virtual Machine disks to Managed Disks,Microsoft.Compute/virtualMachines/convertToManagedDisks/action,Administrative,Administrative
Create an Azure Automation job,Microsoft.Automation/automationAccounts/jobs/write,Administrative,Administrative
Create an Integration Runtime Install Link,Microsoft.Synapse/workspaces/integrationruntimes/createExpressSHIRInstallLink/action,Administrative,Administrative
Create API operation or Update API operation,Microsoft.ApiManagement/service/apis/operations/write,Administrative,Administrative
Create API or Update API,Microsoft.ApiManagement/service/apis/write,Administrative,Administrative
Create Backup Protected Item,Microsoft.RecoveryServices/vaults/backupFabrics/protectionContainers/protectedItems/write,Administrative,Administrative
Create backup Protection Intent,Microsoft.RecoveryServices/vaults/backupFabrics/backupProtectionIntent/write,Administrative,Administrative
Create deny assignment,Microsoft.Authorization/denyAssignments/write,Administrative,Administrative
Create Deployment,Microsoft.Resources/deployments/write,Administrative,Administrative
Create named value or Update named value,Microsoft.ApiManagement/service/namedValues/write,Administrative,Administrative
Create new OMS solution,Microsoft.OperationsManagement/solutions/write,Administrative,Administrative
Create new or update existing elastic pool,Microsoft.Sql/servers/elasticpools/write,Administrative,Administrative
Create or Update a Bastion Host,Microsoft.Network/bastionHosts/write,Administrative,Administrative
Create or update a private link service proxy.,Microsoft.Network/privateEndpoints/privateLinkServiceProxies/write,Administrative,Administrative
Create or Update a SaaS Subscription Level resource,Microsoft.SaaS/resources/write,Administrative,Administrative
Create or Update a taskrun for a container registry.,Microsoft.ContainerRegistry/registries/taskRuns/write,Administrative,Administrative
Create or update a view,Microsoft.OperationalInsights/workspaces/views/write,Administrative,Administrative
Create or update action group,microsoft.insights/actionGroups/write,Administrative,Administrative
Create or update action group,microsoft.insights/actiongroups/write,Administrative,Administrative
Create or update action group,Microsoft.Insights/actiongroups/write,Administrative,Administrative
Create or update action group,Microsoft.Insights/actionGroups/write,Administrative,Administrative
Create or update activity log alert,Microsoft.Insights/activityLogAlerts/write,Administrative,Administrative
Create or Update Agent Pool,Microsoft.ContainerService/managedClusters/agentPools/write,Administrative,Administrative
Create or Update Agent Pool,Microsoft.ContainerService/managedClusters/agentpools/write,Administrative,Administrative
Create or Update an Azure Automation account,Microsoft.Automation/automationAccounts/write,Administrative,Administrative
Create or Update an Azure Automation account,microsoft.automation/automationaccounts/write,Administrative,Administrative
Create or Update an Azure Automation connection asset,Microsoft.Automation/automationAccounts/connections/write,Administrative,Administrative
Create or Update an Azure Automation credential asset,Microsoft.Automation/automationAccounts/credentials/write,Administrative,Administrative
Create or Update an Azure Automation Powershell module,Microsoft.Automation/automationAccounts/modules/write,Administrative,Administrative
Create or Update an Azure Automation Runbook,Microsoft.Automation/automationAccounts/runbooks/write,Administrative,Administrative
Create or update an private endpoint.,Microsoft.Network/privateEndpoints/write,Administrative,Administrative
Create or Update API Management Service instance,Microsoft.ApiManagement/service/write,Administrative,Administrative
Create or Update Availability Set,Microsoft.Compute/availabilitySets/write,Administrative,Administrative
Create or Update Azure Automation certificate,Microsoft.Automation/automationAccounts/certificates/write,Administrative,Administrative
Create or Update Cloud Endpoints,Microsoft.StorageSync/storageSyncServices/syncGroups/cloudEndpoints/write,Administrative,Administrative
Create or Update Cloud Endpoints,microsoft.storagesync/storageSyncServices/syncGroups/cloudEndpoints/write,Administrative,Administrative
Create or update Container Group,Microsoft.ContainerInstance/containerGroups/write,Administrative,Administrative
Create or Update Container Registry,Microsoft.ContainerRegistry/registries/write,Administrative,Administrative
Create or update custom role definition,Microsoft.Authorization/roleDefinitions/write,Administrative,Administrative
Create or update data collection rule association,microsoft.insights/dataCollectionRuleAssociations/write,Administrative,Administrative
Create or Update Disk,Microsoft.Compute/disks/write,Administrative,Administrative
Create or Update Firewall Policy,Microsoft.Network/firewallPolicies/write,Administrative,Administrative
Create or Update Image,Microsoft.Compute/images/write,Administrative,Administrative
Create or Update Integration Runtimes.,Microsoft.Synapse/workspaces/integrationruntimes/write,Administrative,Administrative
Create or Update Integration Runtimes.,Microsoft.Synapse/workspaces/integrationRuntimes/write,Administrative,Administrative
Create or update IP Firewall Rule.,Microsoft.Synapse/workspaces/firewallrules/write,Administrative,Administrative
Create or update IP Firewall Rule.,Microsoft.Synapse/workspaces/firewallRules/write,Administrative,Administrative
Create or Update Jobs in Machine Learning Services Workspace(s),Microsoft.MachineLearningServices/workspaces/jobs/write,Administrative,Administrative
Create or Update Load Balancer,Microsoft.Network/loadBalancers/write,Administrative,Administrative
Create or update load balancer backend address pool,Microsoft.Network/loadBalancers/backendAddressPools/write,Administrative,Administrative
Create or Update Machine Learning Services Workspace Linked Service(s),Microsoft.MachineLearningServices/workspaces/linkedServices/write,Administrative,Administrative
Create or Update Managed Cluster,Microsoft.ContainerService/managedClusters/write,Administrative,Administrative
Create or Update Managed Cluster,microsoft.containerservice/managedClusters/write,Administrative,Administrative
Create or Update Managed Cluster,microsoft.containerservice/managedclusters/write,Administrative,Administrative
Create or update metric alert,microsoft.insights/metricAlerts/write,Administrative,Administrative
Create or update metric alert,microsoft.insights/metricalerts/write,Administrative,Administrative
Create or Update Network Interface,Microsoft.Network/networkInterfaces/write,Administrative,Administrative
Create or Update Network Security Group,Microsoft.Network/networkSecurityGroups/write,Administrative,Administrative
Create or Update Private DNS Zone,Microsoft.Network/privateDnsZones/write,Administrative,Administrative
Create or Update Private DNS zone link to virtual network,Microsoft.Network/privateDnsZones/virtualNetworkLinks/write,Administrative,Administrative
Create or Update Private Endpoint Connection,Microsoft.EventHub/namespaces/privateEndpointConnections/write,Administrative,Administrative
Create or update Private Endpoint Connection,Microsoft.Purview/accounts/privateEndpointConnections/write,Administrative,Administrative
Create or Update Private Endpoint Connection,Microsoft.Synapse/workspaces/privateEndpointConnections/write,Administrative,Administrative
Create or Update Private Endpoint Connection Proxy,Microsoft.Synapse/workspaces/privateEndpointConnectionProxies/write,Administrative,Administrative
Create or Update Public Ip Address,Microsoft.Network/publicIPAddresses/write,Administrative,Administrative
Create or Update Public Ip Address,Microsoft.Network/publicIpAddresses/write,Administrative,Administrative
Create or update record set of type A,Microsoft.Network/privateDnsZones/A/write,Administrative,Administrative
Create or Update Registered Server,Microsoft.StorageSync/storageSyncServices/registeredServers/write,Administrative,Administrative
Create or update resource diagnostic setting,microsoft.insights/diagnosticSettings/write,Administrative,Administrative
Create or update resource diagnostic setting,Microsoft.Insights/diagnosticSettings/write,Administrative,Administrative
Create or Update Restore Point Collection,Microsoft.Compute/restorePointCollections/write,Administrative,Administrative
Create or Update Route,Microsoft.Network/routeTables/routes/write,Administrative,Administrative
Create or Update Route Table,Microsoft.Network/routeTables/write,Administrative,Administrative
Create or Update Security Rule,Microsoft.Network/networkSecurityGroups/securityRules/write,Administrative,Administrative
Create or Update Server Endpoints,microsoft.storagesync/storageSyncServices/syncGroups/serverEndpoints/write,Administrative,Administrative
Create or Update server vulnerability assessments,Microsoft.Security/serverVulnerabilityAssessments/write,Administrative,Administrative
Create or Update Snapshot,Microsoft.Compute/snapshots/write,Administrative,Administrative
Create or Update Spark pools.,Microsoft.Synapse/workspaces/bigDataPools/write,Administrative,Administrative
Create or Update SQL Analytics pool Auditing Settings.,Microsoft.Synapse/workspaces/sqlPools/auditingSettings/write,Administrative,Administrative
Create or Update SQL Analytics pool Maintenance Windows.,Microsoft.Synapse/workspaces/sqlPools/maintenanceWindows/write,Administrative,Administrative
Create or Update SQL Analytics pool Transparent Data Encryption Configuration.,Microsoft.Synapse/workspaces/sqlPools/transparentDataEncryption/write,Administrative,Administrative
Create or Update SQL Analytics pools.,Microsoft.Synapse/workspaces/sqlPools/write,Administrative,Administrative
Create or Update SQL server auditing settings.,Microsoft.Synapse/workspaces/auditingSettings/write,Administrative,Administrative
Create or Update SQL server security alert policies.,Microsoft.Synapse/workspaces/securityAlertPolicies/write,Administrative,Administrative
Create or Update SQL server vulnerability assement report.,Microsoft.Synapse/workspaces/vulnerabilityAssessments/write,Administrative,Administrative
Create or Update Static Site,Microsoft.Web/staticSites/write,Administrative,Administrative
Create or Update Sync Groups,Microsoft.StorageSync/storageSyncServices/syncGroups/write,Administrative,Administrative
Create or Update Tagged Traffic Consumer,microsoft.network/virtualNetworks/taggedTrafficConsumers/write,Administrative,Administrative
Create or Update Tagged Traffic Consumer,Microsoft.Network/virtualNetworks/taggedTrafficConsumers/write,Administrative,Administrative
Create or Update Tagged Traffic Consumer,microsoft.network/virtualnetworks/taggedTrafficConsumers/write,Administrative,Administrative
Create or Update Virtual Machine,Microsoft.Compute/virtualMachines/write,Administrative,Administrative
Create or Update Virtual Machine,microsoft.compute/virtualMachines/write,Administrative,Administrative
Create or Update Virtual Machine Extension,Microsoft.Compute/virtualMachines/extensions/write,Administrative,Administrative
Create or Update Virtual Machine Scale Set,Microsoft.Compute/virtualMachineScaleSets/write,Administrative,Administrative
Create or Update Virtual Machine Scale Set Extension,Microsoft.Compute/virtualMachineScaleSets/extensions/write,Administrative,Administrative
Create or Update Virtual Network,Microsoft.Network/virtualNetworks/write,Administrative,Administrative
Create or Update Virtual Network Peering,Microsoft.Network/virtualNetworks/virtualNetworkPeerings/write,Administrative,Administrative
Create or Update Virtual Network Subnet,Microsoft.Network/virtualNetworks/subnets/write,Administrative,Administrative
Create or Update Workspace Keys,Microsoft.Synapse/workspaces/keys/write,Administrative,Administrative
Create or Update Workspaces.,Microsoft.Synapse/workspaces/write,Administrative,Administrative
Create Packet Capture,Microsoft.Network/networkWatchers/packetCaptures/write,Administrative,Administrative
Create policy assignment,Microsoft.Authorization/policyAssignments/write,Administrative,Administrative
Create policy exemption,Microsoft.Authorization/policyExemptions/write,Administrative,Administrative
Create policy set definition,Microsoft.Authorization/policySetDefinitions/write,Administrative,Administrative
Create Private Endpoint Connection Proxy,Microsoft.ContainerRegistry/registries/privateEndpointConnectionProxies/write,Administrative,Administrative
Create Private Endpoint Connection Proxy,Microsoft.EventHub/namespaces/privateEndpointConnectionProxies/write,Administrative,Administrative
Create product or Update product,Microsoft.ApiManagement/service/products/write,Administrative,Administrative
Create Protection Policy,Microsoft.RecoveryServices/vaults/backupPolicies/write,Administrative,Administrative
Create Registered Container,Microsoft.RecoveryServices/vaults/backupFabrics/protectionContainers/write,Administrative,Administrative
Create Restore Point,Microsoft.Compute/restorePointCollections/restorePoints/write,Administrative,Administrative
Create role assignment,Microsoft.Authorization/roleAssignments/write,Administrative,Administrative
Create Smart Detector alert rule,microsoft.alertsmanagement/smartDetectorAlertRules/write,Administrative,Administrative
Create Smart Detector alert rule,microsoft.alertsmanagement/smartdetectoralertrules/write,Administrative,Administrative
Create SQL Analytics pool Restore Point.,Microsoft.Synapse/workspaces/sqlPools/restorePoints/action,Administrative,Administrative
Create Vault,Microsoft.RecoveryServices/vaults/write,Administrative,Administrative
Create VersionSet or Update VersionSet,Microsoft.ApiManagement/service/apiVersionSets/write,Administrative,Administrative
Create Workspace,Microsoft.OperationalInsights/workspaces/write,Administrative,Administrative
Create/Update Azure SQL Database Private Endpoint Connection Proxy,Microsoft.Sql/servers/privateEndpointConnectionProxies/write,Administrative,Administrative
Create/Update Azure SQL Server Keys,Microsoft.Sql/servers/keys/write,Administrative,Administrative
Create/Update Azure SQL Server Virtual Network Rule,Microsoft.Sql/servers/virtualNetworkRules/write,Administrative,Administrative
Create/Update Database Backup Archival Policy,Microsoft.Sql/servers/databases/backupLongTermRetentionPolicies/write,Administrative,Administrative
Create/Update datasources under a workspace.,Microsoft.OperationalInsights/workspaces/datasources/write,Administrative,Administrative
Create/Update linked services under given workspace.,microsoft.operationalinsights/workspaces/linkedServices/write,Administrative,Administrative
Create/Update linked services under given workspace.,Microsoft.OperationalInsights/workspaces/linkedServices/write,Administrative,Administrative
Create/Update Storage Account,Microsoft.Storage/storageAccounts/write,Administrative,Administrative
Create/Update User Assigned Identity,Microsoft.ManagedIdentity/userAssignedIdentities/write,Administrative,Administrative
Creates a restore point,Microsoft.Sql/servers/databases/restorePoints/action,Administrative,Administrative
Creates an Azure Automation Private Endpoint Connection Proxy,Microsoft.Automation/automationAccounts/privateEndpointConnectionProxies/write,Administrative,Administrative
Creates or updates a Machine Learning Services Workspace(s),Microsoft.MachineLearningServices/workspaces/write,Administrative,Administrative
Creates or updates a Service Association Link,Microsoft.Network/virtualNetworks/subnets/serviceAssociationLinks/write,Administrative,Administrative
Creates or updates an Azure Firewall,Microsoft.Network/azureFirewalls/write,Administrative,Administrative
Creates or updates batch inference endpoint in Machine Learning Services Workspace(s),Microsoft.MachineLearningServices/workspaces/batchEndpoints/write,Administrative,Administrative
Creates or updates deployments in batch inference endpoint in Machine Learning Services Workspace(s),Microsoft.MachineLearningServices/workspaces/batchEndpoints/deployments/write,Administrative,Administrative
Creates or updates the compute resources in Machine Learning Services Workspace(s),Microsoft.MachineLearningServices/workspaces/computes/write,Administrative,Administrative
CreateWebSite,CreateWebSite,Administrative,Administrative
Data Share ListSourceShareSynchronizationSettings Action,Microsoft.DataShare/accounts/shareSubscriptions/listSourceShareSynchronizationSettings/action,Administrative,Administrative
Data Share ListSynchronizationDetails Action,Microsoft.DataShare/accounts/shareSubscriptions/ListSynchronizationDetails/action,Administrative,Administrative
Data Share ListSynchronizations Action,Microsoft.DataShare/accounts/shareSubscriptions/ListSynchronizations/action,Administrative,Administrative
Data Share Synchronize Action,Microsoft.DataShare/accounts/shareSubscriptions/Synchronize/action,Administrative,Administrative
Deallocate Virtual Machine,Microsoft.Compute/virtualMachines/deallocate/action,Administrative,Administrative
Deallocate Virtual Machine Scale Set,Microsoft.Compute/virtualMachineScaleSets/deallocate/action,Administrative,Administrative
Delete a Cluster principal assignments resource,Microsoft.Synapse/workspaces/kustoPools/principalAssignments/delete,Administrative,Administrative
Delete a database principal assignments resource,Microsoft.Kusto/Clusters/databases/principalAssignments/delete,Administrative,Administrative
Delete Agent Pool,Microsoft.ContainerService/managedClusters/agentPools/delete,Administrative,Administrative
Delete an Azure Automation account,Microsoft.Automation/automationAccounts/delete,Administrative,Administrative
Delete an Azure Automation certificate,Microsoft.Automation/automationAccounts/certificates/delete,Administrative,Administrative
Delete an Azure Automation Runbook,Microsoft.Automation/automationAccounts/runbooks/delete,Administrative,Administrative
Delete an private endpoint.,Microsoft.Network/privateEndpoints/delete,Administrative,Administrative
Delete Availability Set,Microsoft.Compute/availabilitySets/delete,Administrative,Administrative
Delete Azure SQL Database Private Endpoint Connection Proxy,Microsoft.Sql/servers/privateEndpointConnectionProxies/delete,Administrative,Administrative
Delete Azure SQL Server Virtual Network Rule,Microsoft.Sql/servers/virtualNetworkRules/delete,Administrative,Administrative
Delete blob container,Microsoft.Storage/storageAccounts/blobServices/containers/delete,Administrative,Administrative
Delete Cloud Endpoints,microsoft.storagesync/storageSyncServices/syncGroups/cloudEndpoints/delete,Administrative,Administrative
Delete cluster resource,Microsoft.Synapse/workspaces/kustoPools/delete,Administrative,Administrative
Delete cluster resource,Microsoft.Synapse/workspaces/KustoPools/delete,Administrative,Administrative
Delete Container Group,Microsoft.ContainerInstance/containerGroups/delete,Administrative,Administrative
Delete Container Registry,Microsoft.ContainerRegistry/registries/delete,Administrative,Administrative
Delete custom role definition,Microsoft.Authorization/roleDefinitions/delete,Administrative,Administrative
Delete data collection rule association,microsoft.insights/dataCollectionRuleAssociations/delete,Administrative,Administrative
Delete Data Share Account,Microsoft.DataShare/accounts/delete,Administrative,Administrative
Delete Data Share Share,Microsoft.DataShare/accounts/shares/delete,Administrative,Administrative
Delete database resource,Microsoft.Kusto/Clusters/Databases/delete,Administrative,Administrative
Delete deny assignment,Microsoft.Authorization/denyAssignments/delete,Administrative,Administrative
Delete Deployment,Microsoft.Resources/deployments/delete,Administrative,Administrative
Delete deployment script,Microsoft.Resources/deploymentScripts/delete,Administrative,Administrative
Delete Disk,Microsoft.Compute/disks/delete,Administrative,Administrative
Delete elastic pool,Microsoft.Sql/servers/elasticpools/delete,Administrative,Administrative
Delete EventSubscription,Microsoft.EventGrid/eventSubscriptions/delete,Administrative,Administrative
Delete File Share,Microsoft.Storage/storageAccounts/fileServices/shares/delete,Administrative,Administrative
Delete Firewall Policy,Microsoft.Network/firewallPolicies/delete,Administrative,Administrative
Delete hosting plan,Microsoft.Web/serverFarms/delete,Administrative,Administrative
Delete Image,Microsoft.Compute/images/delete,Administrative,Administrative
Delete Integration Runtime Node.,Microsoft.Synapse/workspaces/integrationruntimes/nodes/delete,Administrative,Administrative
Delete Integration Runtimes,Microsoft.Synapse/workspaces/integrationRuntimes/delete,Administrative,Administrative
Delete IP Firewall Rule,Microsoft.Synapse/workspaces/firewallRules/delete,Administrative,Administrative
Delete Key Vault,Microsoft.KeyVault/vaults/delete,Administrative,Administrative
Delete Load Balancer,Microsoft.Network/loadBalancers/delete,Administrative,Administrative
Delete Machine Learning Services Workspace Linked Service(s),Microsoft.MachineLearningServices/workspaces/linkedServices/delete,Administrative,Administrative
Delete Managed Cluster,Microsoft.ContainerService/managedClusters/delete,Administrative,Administrative
Delete management locks,Microsoft.Authorization/locks/delete,Administrative,Administrative
