OperationName,OperationNameValue,Category,CategoryValue
Puts an Azure Automation DSC's content,Microsoft.Automation/automationAccounts/configurations/write,Administrative,Administrative
Read database account readonly keys,Microsoft.DocumentDB/databaseAccounts/readonlykeys/action,Administrative,Administrative
Reads avaible SKUs for an subscription.,Microsoft.CognitiveServices/locations/checkSkuAvailability/action,Administrative,Administrative
Reapply a virtual machine's current model,Microsoft.Compute/virtualMachines/Reapply/action,Administrative,Administrative
Redeploy Virtual Machine,Microsoft.Compute/virtualMachines/Redeploy/action,Administrative,Administrative
Refresh container,Microsoft.RecoveryServices/vaults/backupFabrics/refreshContainers/action,Administrative,Administrative
Regenerate auth key of an Integration Runtime,Microsoft.Synapse/workspaces/integrationruntimes/regenerateAuthKey/action,Administrative,Administrative
Regenerate Storage Account Keys,Microsoft.Storage/storageAccounts/regenerateKey/action,Administrative,Administrative
Register a subscription to a resource provider.,Microsoft.OperationalInsights/register/action,Administrative,Administrative
Register Microsoft Container Instance,Microsoft.ContainerInstance/register/action,Administrative,Administrative
Register Microsoft DocumentDB resource provider,Microsoft.DocumentDB/register/action,Administrative,Administrative
Register Microsoft.Insights,Microsoft.Insights/register/action,Administrative,Administrative
Register Microsoft.Web resource provider,Microsoft.Web/register/action,Administrative,Administrative
Register Provider Feature,Microsoft.Features/providers/features/register/action,Administrative,Administrative
Register Resource Provider,Microsoft.Logic/register/action,Administrative,Administrative
Register Subscription,microsoft.iotsecurity/register/action,Administrative,Administrative
Register Subscription,Microsoft.Network/register/action,Administrative,Administrative
Register Subscription,microsoft.security/register/action,Administrative,Administrative
Register Subscription,Microsoft.Security/register/action,Administrative,Administrative
Register Subscription for Container Service,Microsoft.ContainerService/register/action,Administrative,Administrative
Register Subscription for VMHealth,Microsoft.WorkloadMonitor/register/action,Administrative,Administrative
Register the Container Registry Resource Provider,Microsoft.ContainerRegistry/register/action,Administrative,Administrative
Register the Microsoft.HybridContainerService,microsoft.hybridcontainerservice/register/action,Administrative,Administrative
Register the Microsoft.ServiceLinker,Microsoft.ServiceLinker/register/action,Administrative,Administrative
Register the Search Resource Provider,Microsoft.Search/register/action,Administrative,Administrative
Register with the Provider,Microsoft.ResourceHealth/register/action,Administrative,Administrative
Registers the Azure Subscription with Microsoft.VisualStudio provider,Microsoft.VisualStudio/register/action,Administrative,Administrative
Registers the Microsoft SQL Database Resource Provider,Microsoft.Sql/register/action,Administrative,Administrative
Registers the Storage Resource Provider,Microsoft.Storage/register/action,Administrative,Administrative
Reimage Virtual Machine Scale Set,Microsoft.Compute/virtualMachineScaleSets/reimage/action,Administrative,Administrative
Remove API,Microsoft.ApiManagement/service/apis/delete,Administrative,Administrative
Remove API from product,Microsoft.ApiManagement/service/products/apis/delete,Administrative,Administrative
Remove API operation,Microsoft.ApiManagement/service/apis/operations/delete,Administrative,Administrative
Remove API Operation policy configuration from policies,Microsoft.ApiManagement/service/apis/operations/policies/delete,Administrative,Administrative
Remove language extensions action,Microsoft.Synapse/workspaces/kustoPools/removeLanguageExtensions/action,Administrative,Administrative
Remove product,Microsoft.ApiManagement/service/products/delete,Administrative,Administrative
Replace all Ip Firewall Rules for the Workspace.,Microsoft.Synapse/workspaces/replaceAllIpFirewallRules/action,Administrative,Administrative
Resolve private link service id,Microsoft.ContainerService/managedClusters/resolvePrivateLinkServiceId/action,Administrative,Administrative
Restart compute resource in Machine Learning Services Workspace,Microsoft.MachineLearningServices/workspaces/computes/restart/action,Administrative,Administrative
Restart Virtual Machine,Microsoft.Compute/virtualMachines/restart/action,Administrative,Administrative
Restart Virtual Machine instance in a Virtual Machine Scale Set,Microsoft.Compute/virtualMachineScaleSets/virtualMachines/restart/action,Administrative,Administrative
Restart Web App,Microsoft.Web/sites/restart/action,Administrative,Administrative
Restore Recovery Points,Microsoft.RecoveryServices/vaults/backupFabrics/protectionContainers/protectedItems/recoveryPoints/restore/action,Administrative,Administrative
Resume a Datawarehouse database.,Microsoft.Sql/servers/databases/resume/action,Administrative,Administrative
Resume SQL Analytics pools.,Microsoft.Synapse/workspaces/sqlPools/resume/action,Administrative,Administrative
Retrieve boot diagnostic logs blob URIs,Microsoft.Compute/virtualMachines/retrieveBootDiagnosticsData/action,Administrative,Administrative
Returns Storage Account SAS Token,Microsoft.Storage/storageAccounts/listAccountSas/action,Administrative,Administrative
Returns Storage Account SAS Token,Microsoft.Storage/storageAccounts/ListAccountSas/action,Administrative,Administrative
Returns Storage Service SAS Token,Microsoft.Storage/storageAccounts/ListServiceSas/action,Administrative,Administrative
Revoke Disk SAS URI,Microsoft.Compute/disks/endGetAccess/action,Administrative,Administrative
Revoke incremental DiskRestorePoint SAS URI,Microsoft.Compute/restorePointCollections/restorePoints/diskRestorePoints/endGetAccess/action,Administrative,Administrative
Revoke Instant Item Recovery for Protected Item,Microsoft.RecoveryServices/vaults/backupFabrics/protectionContainers/protectedItems/recoveryPoints/revokeInstantItemRecovery/action,Administrative,Administrative
Revoke Snapshot SAS URI,Microsoft.Compute/snapshots/endGetAccess/action,Administrative,Administrative
Run Command on a Virtual Machine instance in a Virtual Machine Scale Set.,Microsoft.Compute/virtualMachineScaleSets/virtualmachines/runCommand/action,Administrative,Administrative
Run Command on Virtual Machine,Microsoft.Compute/virtualMachines/runCommand/action,Administrative,Administrative
Scheduled Maintenance,Scheduled Maintenance,Administrative,Administrative
Set API operation policy configuration,Microsoft.ApiManagement/service/apis/operations/policies/write,Administrative,Administrative
Set API policy configuration,Microsoft.ApiManagement/service/apis/policies/write,Administrative,Administrative
Set Dashboard,Microsoft.Portal/dashboards/write,Administrative,Administrative
Set Data Warehouse maintenance windows.,Microsoft.Sql/servers/databases/maintenanceWindows/write,Administrative,Administrative
Set database blob auditing policy,Microsoft.Sql/servers/databases/auditingSettings/write,Administrative,Administrative
Set policy fragment,Microsoft.ApiManagement/service/policyfragments/write,Administrative,Administrative
Set policy fragment,Microsoft.ApiManagement/service/policyFragments/write,Administrative,Administrative
Set Product policy configuration,Microsoft.ApiManagement/service/products/policies/write,Administrative,Administrative
Set Search Service,Microsoft.Search/searchServices/write,Administrative,Administrative
Set server blob auditing policy,Microsoft.Sql/servers/auditingsettings/write,Administrative,Administrative
Set server blob auditing policy,Microsoft.Sql/servers/auditingSettings/write,Administrative,Administrative
Set server DevOps audit policy,Microsoft.Sql/servers/devOpsAuditingSettings/write,Administrative,Administrative
Set server vulnerability assessment,Microsoft.Sql/servers/vulnerabilityassessments/write,Administrative,Administrative
Set server vulnerability assessment,Microsoft.Sql/servers/vulnerabilityAssessments/write,Administrative,Administrative
Set tenant policy configuration or Update tenant access information or Update tenant access information,Microsoft.ApiManagement/service/tenant/write,Administrative,Administrative
Set Workflow,Microsoft.Logic/workflows/write,Administrative,Administrative
Sets schema used by the API,Microsoft.ApiManagement/service/apis/schemas/write,Administrative,Administrative
Sets the properties for a specific workload group.,Microsoft.Sql/servers/databases/workloadGroups/write,Administrative,Administrative
Sets the properties for a specific workload group.,Microsoft.Synapse/workspaces/sqlPools/workloadGroups/write,Administrative,Administrative
Start compute resource in Machine Learning Services Workspace,Microsoft.MachineLearningServices/workspaces/computes/start/action,Administrative,Administrative
Start Container Group,Microsoft.ContainerInstance/containerGroups/start/action,Administrative,Administrative
Start Managed Cluster,Microsoft.ContainerService/managedClusters/start/action,Administrative,Administrative
Start Virtual Machine,Microsoft.Compute/virtualMachines/start/action,Administrative,Administrative
Start Web App,Microsoft.Web/sites/start/action,Administrative,Administrative
Stop compute resource in Machine Learning Services Workspace,Microsoft.MachineLearningServices/workspaces/computes/stop/action,Administrative,Administrative
Stop Managed Cluster,Microsoft.ContainerService/managedClusters/stop/action,Administrative,Administrative
Stop Packet Capture,Microsoft.Network/networkWatchers/packetCaptures/stop/action,Administrative,Administrative
Stop Web App,Microsoft.Web/sites/stop/action,Administrative,Administrative
Subscribe to product or Update subscription,Microsoft.ApiManagement/service/subscriptions/write,Administrative,Administrative
subscriptions/f5c54685-b042-4885-8436-7914f7c53e53/Prod-USE2-Servers-ResourceGroup/Microsoft.Automation/az-mgmt-automation/write,subscriptions/f5c54685-b042-4885-8436-7914f7c53e53/Prod-USE2-Servers-ResourceGroup/Microsoft.Automation/az-mgmt-automation/write,Administrative,Administrative
Sync Web Apps,Microsoft.Web/sites/sync/action,Administrative,Administrative
Sync Web Apps Function Triggers,Microsoft.Web/sites/host/sync/action,Administrative,Administrative
Sync Web Apps Function Triggers,Microsoft.Web/sites/syncfunctiontriggers/action,Administrative,Administrative
Trigger Run,Microsoft.Logic/workflows/triggers/run/action,Administrative,Administrative
Update Access Policy,Microsoft.KeyVault/vaults/accessPolicies/write,Administrative,Administrative
Update App Service Network Configuration,Microsoft.Web/sites/networkConfig/write,Administrative,Administrative
Update automatic tuning settings for the server,Microsoft.Sql/servers/automaticTuning/write,Administrative,Administrative
Update Azure SQL Server Encryption Protector,Microsoft.Sql/servers/encryptionProtector/write,Administrative,Administrative
Update compute idle shutdown settings in Machine Learning Services Workspace,Microsoft.MachineLearningServices/workspaces/computes/updateIdleShutdownSetting/action,Administrative,Administrative
Update database account,Microsoft.DocumentDb/databaseAccounts/write,Administrative,Administrative
Update hosting plan,Microsoft.Web/serverfarms/write,Administrative,Administrative
Update hosting plan,Microsoft.Web/serverFarms/write,Administrative,Administrative
Update insights component,Microsoft.Insights/components/write,Administrative,Administrative
Update insights component,microsoft.insights/components/write,Administrative,Administrative
Update Key Vault,Microsoft.KeyVault/vaults/write,Administrative,Administrative
Update logical database Transparent Data Encryption,Microsoft.Sql/servers/databases/transparentDataEncryption/write,Administrative,Administrative
Update pricing settings,Microsoft.Security/pricings/write,Administrative,Administrative
Update resource group,Microsoft.Resources/subscriptions/resourcegroups/write,Administrative,Administrative
Update resource group,Microsoft.Resources/subscriptions/resourceGroups/write,Administrative,Administrative
Update server threat detection policy,Microsoft.Sql/servers/securityalertpolicies/write,Administrative,Administrative
Update server threat detection policy,Microsoft.Sql/servers/securityAlertPolicies/write,Administrative,Administrative
Update SQL database,Microsoft.Sql/servers/databases/write,Administrative,Administrative
Update SQL server,Microsoft.Sql/servers/write,Administrative,Administrative
Update SQL server firewall rules,Microsoft.Sql/servers/firewallRules/write,Administrative,Administrative
Update SQL server firewall rules,Microsoft.Sql/servers/firewallrules/write,Administrative,Administrative
Update the server Advanced Threat Protection settings,Microsoft.Sql/servers/advancedThreatProtectionSettings/write,Administrative,Administrative
Update Trusted Service Bypass configuration for workspace.,Microsoft.Synapse/workspaces/trustedServiceBypassConfiguration/write,Administrative,Administrative
Update Web App Source Control Configuration,Microsoft.Web/sites/sourcecontrols/write,Administrative,Administrative
Update Web Apps Functions,Microsoft.Web/sites/functions/write,Administrative,Administrative
Update web sites config,Microsoft.Web/sites/config/write,Administrative,Administrative
Update web sites config,Microsoft.Web/sites/Config/write,Administrative,Administrative
Update website,Microsoft.Web/sites/write,Administrative,Administrative
Updates a short term retention policy,Microsoft.Sql/servers/databases/backupShortTermRetentionPolicies/write,Administrative,Administrative
Updates the Advanced Threat Protection Settings,Microsoft.Security/advancedThreatProtectionSettings/write,Administrative,Administrative
Updates the properties of a Virtual Machine in a Virtual Machine Scale Set,Microsoft.Compute/virtualMachineScaleSets/virtualMachines/write,Administrative,Administrative
UpdateWebSite,UpdateWebSite,Administrative,Administrative
Upgrade an Integration Runtime,Microsoft.Synapse/workspaces/integrationruntimes/upgrade/action,Administrative,Administrative
Validate ,Microsoft.Web/validate/action,Administrative,Administrative
Validate a Private Endpoint Connection Proxy,Microsoft.KeyVault/vaults/privateEndpointConnectionProxies/validate/action,Administrative,Administrative
Validate Azure SQL Database Private Endpoint Connection Creation by NRP,Microsoft.Sql/servers/privateEndpointConnectionProxies/validate/action,Administrative,Administrative
Validate Deployment,Microsoft.Resources/deployments/validate/action,Administrative,Administrative
Validate Features,Microsoft.RecoveryServices/locations/backupValidateFeatures/action,Administrative,Administrative
Validate Move Resource Group Resources,Microsoft.Resources/subscriptions/resourceGroups/validateMoveResources/action,Administrative,Administrative
Validate Operation on Protected Item,Microsoft.RecoveryServices/vaults/backupTriggerValidateOperation/action,Administrative,Administrative
Validate Private Endpoint Connection Proxies,Microsoft.Storage/storageAccounts/privateEndpointConnectionProxies/validate/action,Administrative,Administrative
Validate Private Endpoint Connection Proxy,Microsoft.ContainerRegistry/registries/privateEndpointConnectionProxies/validate/action,Administrative,Administrative
Validate Private Endpoint Connection Proxy,Microsoft.EventHub/namespaces/privateEndpointConnectionProxies/validate/action,Administrative,Administrative
Validate Private Endpoint Connection Proxy,Microsoft.Purview/accounts/privateEndpointConnectionProxies/validate/action,Administrative,Administrative
Validate private endpoint connection proxy,Microsoft.Synapse/workspaces/KustoPools/privateEndpointConnectionProxies/validate/action,Administrative,Administrative
Validate Tagged Traffic Consumer,microsoft.network/virtualNetworks/taggedTrafficConsumers/validate/action,Administrative,Administrative
Validate Tagged Traffic Consumer,Microsoft.Network/virtualNetworks/taggedTrafficConsumers/validate/action,Administrative,Administrative
Validate Tagged Traffic Consumer,microsoft.network/virtualnetworks/taggedTrafficConsumers/validate/action,Administrative,Administrative
Validates Private Endpoint Connection Proxy,Microsoft.Synapse/workspaces/privateEndpointConnectionProxies/validate/action,Administrative,Administrative
Verify Ip Flow,Microsoft.Network/networkWatchers/ipFlowVerify/action,Administrative,Administrative
Write a Cluster principal assignments resource,Microsoft.Kusto/clusters/principalAssignments/write,Administrative,Administrative
Write a Cluster principal assignments resource,Microsoft.Synapse/workspaces/kustoPools/principalAssignments/write,Administrative,Administrative
Write a database principal assignments resource,Microsoft.Kusto/Clusters/databases/principalAssignments/write,Administrative,Administrative
Write a database principal assignments resource,Microsoft.Synapse/workspaces/kustoPools/databases/principalAssignments/write,Administrative,Administrative
Write an Azure Automation runbook draft,Microsoft.Automation/automationAccounts/runbooks/draft/write,Administrative,Administrative
Write an Azure Automation runbook draft,microsoft.automation/automationAccounts/runbooks/draft/write,Administrative,Administrative
Write cluster resource,Microsoft.Synapse/workspaces/kustoPools/write,Administrative,Administrative
Write cluster resource,Microsoft.Synapse/workspaces/kustopools/write,Administrative,Administrative
Write Data Share Account,Microsoft.DataShare/accounts/write,Administrative,Administrative
Write Data Share DataSet,Microsoft.DataShare/accounts/shares/datasets/write,Administrative,Administrative
Write Data Share DataSetMapping,Microsoft.DataShare/accounts/shareSubscriptions/dataSetMappings/write,Administrative,Administrative
Write Data Share Invitations,Microsoft.DataShare/accounts/shares/invitations/write,Administrative,Administrative
Write Data Share Share,Microsoft.DataShare/accounts/shares/write,Administrative,Administrative
Write Data Share ShareSubscription,Microsoft.DataShare/accounts/shareSubscriptions/write,Administrative,Administrative
Write Data Share Synchronization Setting,Microsoft.DataShare/accounts/shares/synchronizationSettings/write,Administrative,Administrative
Write Data Share Trigger,Microsoft.DataShare/accounts/shareSubscriptions/triggers/write,Administrative,Administrative
Write database resource,Microsoft.Kusto/clusters/databases/write,Administrative,Administrative
Write database resource,Microsoft.Synapse/workspaces/kustopools/databases/write,Administrative,Administrative
Write database resource,Microsoft.Synapse/workspaces/kustoPools/databases/write,Administrative,Administrative
Write deployment script,Microsoft.Resources/deploymentScripts/write,Administrative,Administrative
Write EventSubscription,Microsoft.EventGrid/eventSubscriptions/write,Administrative,Administrative
Write private endpoint connection,Microsoft.Synapse/workspaces/KustoPools/privateEndpointConnections/write,Administrative,Administrative
Write Private Endpoint Connection Proxy,Microsoft.Purview/accounts/privateEndpointConnectionProxies/write,Administrative,Administrative
Write private endpoint connection proxy,Microsoft.Synapse/workspaces/KustoPools/privateEndpointConnectionProxies/write,Administrative,Administrative
Write System Topic,Microsoft.EventGrid/systemTopics/write,Administrative,Administrative
Write tags,Microsoft.Resources/tags/write,Administrative,Administrative
Write template spec,Microsoft.Resources/templateSpecs/write,Administrative,Administrative
Writes Support Ticket,Microsoft.Support/supportTickets/write,Administrative,Administrative
,Microsoft.EdgeOrder/register/action,Administrative,Administrative
,Microsoft.Storage/storageAccounts/encryptionScopes/write,Administrative,Administrative
'audit' Policy action.,Microsoft.Authorization/policies/audit/action,Policy,Policy
'auditIfNotExists' Policy action.,Microsoft.Authorization/policies/auditIfNotExists/action,Policy,Policy
'deployIfNotExists' Policy action.,Microsoft.Authorization/policies/deployIfNotExists/action,Policy,Policy
Microsoft.Authorization/policies/audit/action,Microsoft.Authorization/policies/audit/action,Policy,Policy
Microsoft.Authorization/policies/auditIfNotExists/action,Microsoft.Authorization/policies/auditIfNotExists/action,Policy,Policy
New recommendation is available,Microsoft.Advisor/recommendations/available/action,Recommendation,Recommendation
Health Event Activated,Microsoft.Resourcehealth/healthevent/Activated/action,ResourceHealth,ResourceHealth
Health Event InProgress,Microsoft.Resourcehealth/healthevent/InProgress/action,ResourceHealth,ResourceHealth
Health Event Resolved,Microsoft.Resourcehealth/healthevent/Resolved/action,ResourceHealth,ResourceHealth
Health Event Updated,Microsoft.Resourcehealth/healthevent/Updated/action,ResourceHealth,ResourceHealth
Microsoft.Resourcehealth/healthevent/Activated/action,Microsoft.Resourcehealth/healthevent/Activated/action,ResourceHealth,ResourceHealth
Microsoft.Resourcehealth/healthevent/Updated/action,Microsoft.Resourcehealth/healthevent/Updated/action,ResourceHealth,ResourceHealth
Activate Alert,Microsoft.Security/locations/alerts/activate/action,Security,Security
Microsoft.ServiceHealth/incident/action,Microsoft.ServiceHealth/incident/action,ServiceHealth,ServiceHealth
Microsoft.ServiceHealth/maintenance/action,Microsoft.ServiceHealth/maintenance/action,ServiceHealth,ServiceHealth
,BackupWebSite,,Administrative
,CertificateOrderRenewed,,Administrative
,CertificateOrderStateChanged,,Administrative
,MICROSOFT.ADVISOR/GENERATERECOMMENDATIONS/ACTION,,Administrative
,MICROSOFT.ALERTSMANAGEMENT/ALERTS/CHANGESTATE/ACTION,,Administrative
,MICROSOFT.ALERTSMANAGEMENT/SMARTDETECTORALERTRULES/DELETE,,Administrative
,MICROSOFT.ALERTSMANAGEMENT/SMARTDETECTORALERTRULES/WRITE,,Administrative
,MICROSOFT.APIMANAGEMENT/REGISTER/ACTION,,Administrative
,MICROSOFT.APIMANAGEMENT/SERVICE/APIS/DELETE,,Administrative
,MICROSOFT.APIMANAGEMENT/SERVICE/APIS/OPERATIONS/DELETE,,Administrative
,MICROSOFT.APIMANAGEMENT/SERVICE/APIS/OPERATIONS/POLICIES/DELETE,,Administrative
,MICROSOFT.APIMANAGEMENT/SERVICE/APIS/OPERATIONS/POLICIES/WRITE,,Administrative
,MICROSOFT.APIMANAGEMENT/SERVICE/APIS/OPERATIONS/WRITE,,Administrative
,MICROSOFT.APIMANAGEMENT/SERVICE/APIS/POLICIES/WRITE,,Administrative
,MICROSOFT.APIMANAGEMENT/SERVICE/APIS/SCHEMAS/WRITE,,Administrative
,MICROSOFT.APIMANAGEMENT/SERVICE/APIS/WRITE,,Administrative
,MICROSOFT.APIMANAGEMENT/SERVICE/APIVERSIONSETS/WRITE,,Administrative
,MICROSOFT.APIMANAGEMENT/SERVICE/BACKENDS/WRITE,,Administrative
,MICROSOFT.APIMANAGEMENT/SERVICE/NAMEDVALUES/WRITE,,Administrative
,MICROSOFT.APIMANAGEMENT/SERVICE/POLICYFRAGMENTS/LISTREFERENCES/ACTION,,Administrative
,MICROSOFT.APIMANAGEMENT/SERVICE/POLICYFRAGMENTS/WRITE,,Administrative
,MICROSOFT.APIMANAGEMENT/SERVICE/PORTALSETTINGS/LISTSECRETS/ACTION,,Administrative
,MICROSOFT.APIMANAGEMENT/SERVICE/PRODUCTS/APIS/DELETE,,Administrative
,MICROSOFT.APIMANAGEMENT/SERVICE/PRODUCTS/APIS/WRITE,,Administrative
,MICROSOFT.APIMANAGEMENT/SERVICE/PRODUCTS/DELETE,,Administrative
,MICROSOFT.APIMANAGEMENT/SERVICE/PRODUCTS/GROUPS/WRITE,,Administrative
,MICROSOFT.APIMANAGEMENT/SERVICE/PRODUCTS/POLICIES/WRITE,,Administrative
,MICROSOFT.APIMANAGEMENT/SERVICE/PRODUCTS/WRITE,,Administrative
,MICROSOFT.APIMANAGEMENT/SERVICE/SUBSCRIPTIONS/LISTSECRETS/ACTION,,Administrative
,MICROSOFT.APIMANAGEMENT/SERVICE/SUBSCRIPTIONS/WRITE,,Administrative
,MICROSOFT.APIMANAGEMENT/SERVICE/TENANT/LISTSECRETS/ACTION,,Administrative
,MICROSOFT.APIMANAGEMENT/SERVICE/TENANT/WRITE,,Administrative
,MICROSOFT.APIMANAGEMENT/SERVICE/USERS/TOKEN/ACTION,,Administrative
,Microsoft.ApiManagement/service/write,,Administrative
,MICROSOFT.APIMANAGEMENT/SERVICE/WRITE,,Administrative
,MICROSOFT.APPPLATFORM/REGISTER/ACTION,,Administrative
,MICROSOFT.AUTHORIZATION/DENYASSIGNMENTS/DELETE,,Administrative
,MICROSOFT.AUTHORIZATION/DENYASSIGNMENTS/WRITE,,Administrative
,MICROSOFT.AUTHORIZATION/LOCKS/DELETE,,Administrative
,MICROSOFT.AUTHORIZATION/LOCKS/WRITE,,Administrative
,MICROSOFT.AUTHORIZATION/POLICYASSIGNMENTS/WRITE,,Administrative
,MICROSOFT.AUTHORIZATION/POLICYEXEMPTIONS/WRITE,,Administrative
,MICROSOFT.AUTHORIZATION/POLICYSETDEFINITIONS/WRITE,,Administrative
,MICROSOFT.AUTHORIZATION/ROLEASSIGNMENTS/DELETE,,Administrative
,MICROSOFT.AUTHORIZATION/ROLEASSIGNMENTS/WRITE,,Administrative
,MICROSOFT.AUTHORIZATION/ROLEDEFINITIONS/DELETE,,Administrative
,MICROSOFT.AUTHORIZATION/ROLEDEFINITIONS/WRITE,,Administrative
,MICROSOFT.AUTOMANAGE/CONFIGURATIONPROFILES/WRITE,,Administrative
,MICROSOFT.AUTOMANAGE/REGISTER/ACTION,,Administrative
,MICROSOFT.AUTOMATION/AUTOMATIONACCOUNTS/CERTIFICATES/DELETE,,Administrative
,MICROSOFT.AUTOMATION/AUTOMATIONACCOUNTS/CERTIFICATES/WRITE,,Administrative
,MICROSOFT.AUTOMATION/AUTOMATIONACCOUNTS/COMPILATIONJOBS/WRITE,,Administrative
,MICROSOFT.AUTOMATION/AUTOMATIONACCOUNTS/CONFIGURATIONS/DELETE,,Administrative
,MICROSOFT.AUTOMATION/AUTOMATIONACCOUNTS/CONFIGURATIONS/WRITE,,Administrative
,MICROSOFT.AUTOMATION/AUTOMATIONACCOUNTS/CONNECTIONS/WRITE,,Administrative
,MICROSOFT.AUTOMATION/AUTOMATIONACCOUNTS/CONVERTGRAPHRUNBOOKCONTENT/ACTION,,Administrative
,MICROSOFT.AUTOMATION/AUTOMATIONACCOUNTS/CREDENTIALS/DELETE,,Administrative
,MICROSOFT.AUTOMATION/AUTOMATIONACCOUNTS/CREDENTIALS/WRITE,,Administrative
,MICROSOFT.AUTOMATION/AUTOMATIONACCOUNTS/DELETE,,Administrative
,MICROSOFT.AUTOMATION/AUTOMATIONACCOUNTS/HYBRIDRUNBOOKWORKERGROUPS/DELETE,,Administrative
,MICROSOFT.AUTOMATION/AUTOMATIONACCOUNTS/HYBRIDRUNBOOKWORKERGROUPS/GETWORKERCOUNT/ACTION,,Administrative
,MICROSOFT.AUTOMATION/AUTOMATIONACCOUNTS/HYBRIDRUNBOOKWORKERGROUPS/HYBRIDRUNBOOKWORKERS/DELETE,,Administrative
